{
  "schemaVersion":"2.0.0","setType":"REGRESSION","annotationVersion":"parts-yellow-corrected-public.2",
  "documents":[
    {"documentId":"YD-001","documentFamily":"yellow-parts-slip","physicalRowCount":6,"rows":["YD-001-R01","YD-001-R02","YD-001-R03","YD-001-R04","YD-001-R05","YD-001-R06"],"fieldGT":"parts-yellow-corrected-scoring-only.2#YD-001","sourceOfTruth":["independent original-image review"],"annotationVersion":"parts-yellow-corrected-public.2","reviewStatus":"CONFIRMED","reviewer":"independent reviewer","reviewedAt":"2026-09-11T13:14:55Z","notes":"three captures"},
    {"documentId":"YD-002","documentFamily":"yellow-parts-slip","physicalRowCount":5,"rows":["YD-002-R01","YD-002-R02","YD-002-R03","YD-002-R04","YD-002-R05"],"fieldGT":"parts-yellow-corrected-scoring-only.2#YD-002","sourceOfTruth":["independent original-image review"],"annotationVersion":"parts-yellow-corrected-public.2","reviewStatus":"CONFIRMED","reviewer":"independent reviewer","reviewedAt":"2026-09-11T13:14:55Z","notes":"two captures"},
    {"documentId":"YD-003","documentFamily":"yellow-parts-slip","physicalRowCount":2,"rows":["YD-003-R01","YD-003-R02"],"fieldGT":"parts-yellow-corrected-scoring-only.2#YD-003","sourceOfTruth":["independent original-image review"],"annotationVersion":"parts-yellow-corrected-public.2","reviewStatus":"CONFIRMED","reviewer":"independent reviewer","reviewedAt":"2026-09-11T13:14:55Z","notes":"two captures"},
    {"documentId":"YD-004","documentFamily":"yellow-parts-slip","physicalRowCount":2,"rows":["YD-004-R01","YD-004-R02"],"fieldGT":"parts-yellow-corrected-scoring-only.2#YD-004","sourceOfTruth":["independent original-image review"],"annotationVersion":"parts-yellow-corrected-public.2","reviewStatus":"CONFIRMED","reviewer":"independent reviewer","reviewedAt":"2026-09-11T13:14:55Z","notes":"corrected cross-document duplication"},
    {"documentId":"YD-005","documentFamily":"yellow-parts-slip","physicalRowCount":6,"rows":["YD-005-R01","YD-005-R02","YD-005-R03","YD-005-R04","YD-005-R05","YD-005-R06"],"fieldGT":"parts-yellow-corrected-scoring-only.2#YD-005","sourceOfTruth":["independent original-image review"],"annotationVersion":"parts-yellow-corrected-public.2","reviewStatus":"CONFIRMED","reviewer":"independent reviewer","reviewedAt":"2026-09-11T13:14:55Z","notes":"composite subset"},
    {"documentId":"YD-006","documentFamily":"yellow-parts-slip","physicalRowCount":2,"rows":["YD-006-R01","YD-006-R02"],"fieldGT":"parts-yellow-corrected-scoring-only.2#YD-006","sourceOfTruth":["independent original-image review"],"annotationVersion":"parts-yellow-corrected-public.2","reviewStatus":"CONFIRMED","reviewer":"independent reviewer","reviewedAt":"2026-09-11T13:14:55Z","notes":"composite subset"}
  ],
  "captures":[
    {"captureId":"CAP-0675","imageId":"IMG_0675","reviewCopyHash":null,"historicalEvaluationHash":null,"documentsInCapture":[{"documentId":"YD-001","documentRegion":{"x":null,"y":null,"width":null,"height":null,"coordinateSpace":"normalized-review-copy"},"visibleRowCount":6,"visibleRowIds":["YD-001-R01","YD-001-R02","YD-001-R03","YD-001-R04","YD-001-R05","YD-001-R06"]}],"captureVisibleRowCount":6,"subset":"SINGLE_DOCUMENT","sourceOfTruth":["reviewed capture"],"annotationVersion":"parts-yellow-corrected-public.2","reviewStatus":"CONFIRMED","reviewer":"independent reviewer","reviewedAt":"2026-09-11T13:14:55Z","notes":"hash withheld"},
    {"captureId":"CAP-0676","imageId":"IMG_0676","reviewCopyHash":null,"historicalEvaluationHash":null,"documentsInCapture":[{"documentId":"YD-001","documentRegion":{"x":null,"y":null,"width":null,"height":null,"coordinateSpace":"normalized-review-copy"},"visibleRowCount":6,"visibleRowIds":["YD-001-R01","YD-001-R02","YD-001-R03","YD-001-R04","YD-001-R05","YD-001-R06"]}],"captureVisibleRowCount":6,"subset":"SINGLE_DOCUMENT","sourceOfTruth":["reviewed capture"],"annotationVersion":"parts-yellow-corrected-public.2","reviewStatus":"CONFIRMED","reviewer":"independent reviewer","reviewedAt":"2026-09-11T13:14:55Z","notes":"hash withheld"},
    {"captureId":"CAP-0677","imageId":"IMG_0677","reviewCopyHash":null,"historicalEvaluationHash":null,"documentsInCapture":[{"documentId":"YD-001","documentRegion":{"x":null,"y":null,"width":null,"height":null,"coordinateSpace":"normalized-review-copy"},"visibleRowCount":6,"visibleRowIds":["YD-001-R01","YD-001-R02","YD-001-R03","YD-001-R04","YD-001-R05","YD-001-R06"]}],"captureVisibleRowCount":6,"subset":"SINGLE_DOCUMENT","sourceOfTruth":["reviewed capture"],"annotationVersion":"parts-yellow-corrected-public.2","reviewStatus":"CONFIRMED","reviewer":"independent reviewer","reviewedAt":"2026-09-11T13:14:55Z","notes":"corrected count"},
    {"captureId":"CAP-0678","imageId":"IMG_0678","reviewCopyHash":null,"historicalEvaluationHash":null,"documentsInCapture":[{"documentId":"YD-002","documentRegion":{"x":null,"y":null,"width":null,"height":null,"coordinateSpace":"normalized-review-copy"},"visibleRowCount":5,"visibleRowIds":["YD-002-R01","YD-002-R02","YD-002-R03","YD-002-R04","YD-002-R05"]}],"captureVisibleRowCount":5,"subset":"SINGLE_DOCUMENT","sourceOfTruth":["reviewed capture"],"annotationVersion":"parts-yellow-corrected-public.2","reviewStatus":"CONFIRMED","reviewer":"independent reviewer","reviewedAt":"2026-09-11T13:14:55Z","notes":"hash withheld"},
    {"captureId":"CAP-0679","imageId":"IMG_0679","reviewCopyHash":null,"historicalEvaluationHash":null,"documentsInCapture":[{"documentId":"YD-002","documentRegion":{"x":null,"y":null,"width":null,"height":null,"coordinateSpace":"normalized-review-copy"},"visibleRowCount":5,"visibleRowIds":["YD-002-R01","YD-002-R02","YD-002-R03","YD-002-R04","YD-002-R05"]}],"captureVisibleRowCount":5,"subset":"SINGLE_DOCUMENT","sourceOfTruth":["reviewed capture"],"annotationVersion":"parts-yellow-corrected-public.2","reviewStatus":"CONFIRMED","reviewer":"independent reviewer","reviewedAt":"2026-09-11T13:14:55Z","notes":"hash withheld"},
    {"captureId":"CAP-0680","imageId":"IMG_0680","reviewCopyHash":null,"historicalEvaluationHash":null,"documentsInCapture":[{"documentId":"YD-003","documentRegion":{"x":null,"y":null,"width":null,"height":null,"coordinateSpace":"normalized-review-copy"},"visibleRowCount":2,"visibleRowIds":["YD-003-R01","YD-003-R02"]}],"captureVisibleRowCount":2,"subset":"SINGLE_DOCUMENT","sourceOfTruth":["reviewed capture"],"annotationVersion":"parts-yellow-corrected-public.2","reviewStatus":"CONFIRMED","reviewer":"independent reviewer","reviewedAt":"2026-09-11T13:14:55Z","notes":"hash withheld"},
    {"captureId":"CAP-0681","imageId":"IMG_0681","reviewCopyHash":null,"historicalEvaluationHash":null,"documentsInCapture":[{"documentId":"YD-003","documentRegion":{"x":null,"y":null,"width":null,"height":null,"coordinateSpace":"normalized-review-copy"},"visibleRowCount":2,"visibleRowIds":["YD-003-R01","YD-003-R02"]}],"captureVisibleRowCount":2,"subset":"SINGLE_DOCUMENT","sourceOfTruth":["reviewed capture"],"annotationVersion":"parts-yellow-corrected-public.2","reviewStatus":"CONFIRMED","reviewer":"independent reviewer","reviewedAt":"2026-09-11T13:14:55Z","notes":"hash withheld"},
    {"captureId":"CAP-0682","imageId":"IMG_0682","reviewCopyHash":null,"historicalEvaluationHash":null,"documentsInCapture":[{"documentId":"YD-004","documentRegion":{"x":null,"y":null,"width":null,"height":null,"coordinateSpace":"normalized-review-copy"},"visibleRowCount":2,"visibleRowIds":["YD-004-R01","YD-004-R02"]}],"captureVisibleRowCount":2,"subset":"SINGLE_DOCUMENT","sourceOfTruth":["reviewed capture"],"annotationVersion":"parts-yellow-corrected-public.2","reviewStatus":"CONFIRMED","reviewer":"independent reviewer","reviewedAt":"2026-09-11T13:14:55Z","notes":"corrected GT"},
    {"captureId":"CAP-0683","imageId":"IMG_0683","reviewCopyHash":null,"historicalEvaluationHash":null,"documentsInCapture":[{"documentId":"YD-004","documentRegion":{"x":null,"y":null,"width":null,"height":null,"coordinateSpace":"normalized-review-copy"},"visibleRowCount":2,"visibleRowIds":["YD-004-R01","YD-004-R02"]}],"captureVisibleRowCount":2,"subset":"SINGLE_DOCUMENT","sourceOfTruth":["reviewed capture"],"annotationVersion":"parts-yellow-corrected-public.2","reviewStatus":"CONFIRMED","reviewer":"independent reviewer","reviewedAt":"2026-09-11T13:14:55Z","notes":"corrected GT"},
    {"captureId":"CAP-0684","imageId":"IMG_0684","reviewCopyHash":null,"historicalEvaluationHash":null,"documentsInCapture":[{"documentId":"YD-005","documentRegion":{"x":null,"y":null,"width":null,"height":null,"coordinateSpace":"normalized-review-copy"},"visibleRowCount":6,"visibleRowIds":["YD-005-R01","YD-005-R02","YD-005-R03","YD-005-R04","YD-005-R05","YD-005-R06"]},{"documentId":"YD-006","documentRegion":{"x":null,"y":null,"width":null,"height":null,"coordinateSpace":"normalized-review-copy"},"visibleRowCount":2,"visibleRowIds":["YD-006-R01","YD-006-R02"]}],"captureVisibleRowCount":8,"subset":"MULTI_DOCUMENT_COMPOSITE","sourceOfTruth":["reviewed capture"],"annotationVersion":"parts-yellow-corrected-public.2","reviewStatus":"CONFIRMED","reviewer":"independent reviewer","reviewedAt":"2026-09-11T13:14:55Z","notes":"composite"},
    {"captureId":"CAP-0685","imageId":"IMG_0685","reviewCopyHash":null,"historicalEvaluationHash":null,"documentsInCapture":[{"documentId":"YD-005","documentRegion":{"x":null,"y":null,"width":null,"height":null,"coordinateSpace":"normalized-review-copy"},"visibleRowCount":6,"visibleRowIds":["YD-005-R01","YD-005-R02","YD-005-R03","YD-005-R04","YD-005-R05","YD-005-R06"]},{"documentId":"YD-006","documentRegion":{"x":null,"y":null,"width":null,"height":null,"coordinateSpace":"normalized-review-copy"},"visibleRowCount":2,"visibleRowIds":["YD-006-R01","YD-006-R02"]}],"captureVisibleRowCount":8,"subset":"MULTI_DOCUMENT_COMPOSITE","sourceOfTruth":["reviewed capture"],"annotationVersion":"parts-yellow-corrected-public.2","reviewStatus":"CONFIRMED","reviewer":"independent reviewer","reviewedAt":"2026-09-11T13:14:55Z","notes":"composite"},